{
  "validation_id": "VAL-ERL-2026-06-15-E8DF043A-PENDING",
  "validation_status": "superseded",
  "checked_commit": "e8df043a4117c57ec7aaf9d8f837392b1ef0cc94",
  "checked_paths": [
    "release/final-activation-handoff.md",
    "validation_results/workflow-run-check-2c21eb3e.pending.json",
    "scripts/run_activation_validation.py",
    ".github/workflows/validate-ledger-schemas.yml"
  ],
  "validator": {
    "type": "github-actions",
    "path_or_name": "Validate Ledger Schemas"
  },
  "result_summary": "The earlier no-visible-run observation has been superseded by successful GitHub Actions run 29719676248 for pull-request commit e9f340bd65b170b72082221f713ccffd20c158cd.",
  "activation_effect": "no-activation-change",
  "notes": "Superseded by validation_results/workflow-run-29719676248.passed.json. Supersession records validation evidence only and does not independently complete activation."
}
