{
  "validation_id": "VAL-ERL-2026-07-11-B95A6926-SUPERSEDED",
  "validation_status": "superseded",
  "checked_commit": "a543c412a2579ba6793ea3616a7f2c5effc220d8",
  "checked_paths": [
    "assessments/README.md",
    "assessments/2026-07-federal-detention-protest-use-of-force.md",
    "assessments/evidence/2026-07-federal-detention-protest-frame-index.md",
    "assessments/evidence/2026-07-delaney-hall-source-receipts.md",
    "assessments/constitutional-authority/2026-07-delaney-hall-authority-map.md",
    "assessments/machine/PIT-MODERN-2026-DELANEY-HALL-FORCE.json",
    "assessments/reviews/PIT-MODERN-2026-DELANEY-HALL-FORCE.review.md",
    "assessments/controls/2026-07-delaney-hall-federal-to-state-operational-control.md",
    "assessments/intake/2026-07-delaney-hall-primary-record-intake.json",
    "assessments/events/DH-FORCE-001-ground-restraint.json",
    "assessments/events/DH-FORCE-002-apparent-chemical-agent.json",
    "assessments/events/DH-FORCE-003-baton-display.json",
    "assessments/events/DH-FORCE-004-carry-removal.json",
    "assessments/events/DH-FORCE-005-reported-observer-mediator-contact.json",
    "assessments/events/DH-FORCE-006-crowd-movement.json",
    "assessments/events/DH-FORCE-007-reported-arrests.json",
    "scripts/validate_force_event_packets.py"
  ],
  "validator": {
    "type": "github-actions",
    "path_or_name": "Validate Ledger Schemas",
    "run_id": "",
    "run_url": ""
  },
  "result_summary": "This seven-event pending scope was superseded after force-event validation was strengthened to require filename identity and assessment-index visibility for every packet. No concrete pass or failure was attached.",
  "activation_effect": "no-activation-change",
  "notes": "Historical scope preserved. Supersession does not validate facts, probable cause, necessity, proportionality, lawfulness, or constitutional standing."
}
