{
  "validation_id": "VAL-ERL-2026-07-10-470A4C1E-SUPERSEDED",
  "validation_status": "superseded",
  "checked_commit": "a23c7cec44c3b537ab2e6c778c64c4818a92193b",
  "checked_paths": [
    "assessments/README.md",
    "assessments/2026-07-federal-detention-protest-use-of-force.md",
    "assessments/evidence/2026-07-federal-detention-protest-frame-index.md",
    "assessments/evidence/2026-07-delaney-hall-source-receipts.md",
    "assessments/constitutional-authority/2026-07-delaney-hall-authority-map.md",
    "assessments/machine/PIT-MODERN-2026-DELANEY-HALL-FORCE.json",
    "assessments/reviews/PIT-MODERN-2026-DELANEY-HALL-FORCE.review.md",
    "assessments/controls/2026-07-delaney-hall-federal-to-state-operational-control.md",
    "assessments/intake/2026-07-delaney-hall-primary-record-intake.md",
    "assessments/intake/2026-07-delaney-hall-primary-record-intake.json",
    "schemas/primary-record-intake.schema.json",
    "scripts/validate_assessment_trees.py",
    "scripts/validate_primary_record_intake.py",
    "scripts/run_activation_validation.py",
    ".github/workflows/validate-ledger-schemas.yml",
    "release/release-readiness-checklist.md"
  ],
  "validator": {
    "type": "github-actions",
    "path_or_name": "Validate Ledger Schemas",
    "run_id": "",
    "run_url": ""
  },
  "result_summary": "This pending receipt was superseded after individualized force-event packet schemas, event records, and validation were added. It never received a concrete pass or failure result.",
  "activation_effect": "no-activation-change",
  "notes": "Historical scope preserved. Current pending validation is recorded in validation_results/delaney-hall-assessment-e4a3c01e.pending.json."
}
